[I 2025-07-10 06:17:00,581] Trial 9 finished with value: 0.6286625315946155 and parameters: {'n_estimators': 575, 'max_depth': 10, 'learning_rate': 0.0032950762715095966, 'subsample': 0.730258287187441, 'colsample_bytree': 0.8962174405337715, 'min_child_weight': 1, 'gamma': 0.5312339294979777, 'reg_alpha': 0.6191370043926614, 'reg_lambda': 0.826995089599661, 'scale_pos_weight': 1.58555791371951}. Best is trial 3 with value: 0.6731977629601479.

Training and evaluating models...

Training Logistic Regression...
/home/prateek/miniconda3/lib/python3.12/site-packages/sklearn/linear_model/_logistic.py:469: ConvergenceWarning: lbfgs failed to converge (status=1):
STOP: TOTAL NO. of ITERATIONS REACHED LIMIT.

Increase the number of iterations (max_iter) or scale the data as shown in:
    https://scikit-learn.org/stable/modules/preprocessing.html
Please also refer to the documentation for alternative solver options:
    https://scikit-learn.org/stable/modules/linear_model.html#logistic-regression
  n_iter_i = _check_optimize_result(

Results for Logistic Regression (TEST):
Accuracy: 0.8338
AUC: 0.9118
F1: 0.7538
MCC: 0.6297
Precision: 0.7834
Recall: 0.7264

Confusion Matrix:
[[2817  342]
 [ 466 1237]]

Classification Report:
                   pre       rec       spe        f1       geo       iba       sup

      False       0.86      0.89      0.73      0.87      0.80      0.66      3159
       True       0.78      0.73      0.89      0.75      0.80      0.64      1703

avg / total       0.83      0.83      0.78      0.83      0.80      0.65      4862


Results for Logistic Regression (TRAIN):
Accuracy: 0.8618
AUC: 0.9325
F1: 0.7978
MCC: 0.6934
Precision: 0.8178
Recall: 0.7789

Confusion Matrix:
[[11456  1182]
 [ 1506  5304]]

Classification Report:
                   pre       rec       spe        f1       geo       iba       sup

      False       0.88      0.91      0.78      0.90      0.84      0.72     12638
       True       0.82      0.78      0.91      0.80      0.84      0.70      6810

avg / total       0.86      0.86      0.82      0.86      0.84      0.71     19448


Best Parameters:
{'C': 6.707189587827405, 'penalty': 'l2'}

Training SVM...

Results for SVM (TEST):
Accuracy: 0.8299
AUC: 0.9023
F1: 0.7504
MCC: 0.6221
Precision: 0.7720
Recall: 0.7299

Confusion Matrix:
[[2792  367]
 [ 460 1243]]

Classification Report:
                   pre       rec       spe        f1       geo       iba       sup

      False       0.86      0.88      0.73      0.87      0.80      0.66      3159
       True       0.77      0.73      0.88      0.75      0.80      0.64      1703

avg / total       0.83      0.83      0.78      0.83      0.80      0.65      4862


Results for SVM (TRAIN):
Accuracy: 0.9753
AUC: 0.9930
F1: 0.9643
MCC: 0.9456
Precision: 0.9762
Recall: 0.9527

Confusion Matrix:
[[12480   158]
 [  322  6488]]

Classification Report:
                   pre       rec       spe        f1       geo       iba       sup

      False       0.97      0.99      0.95      0.98      0.97      0.94     12638
       True       0.98      0.95      0.99      0.96      0.97      0.94      6810

avg / total       0.98      0.98      0.96      0.98      0.97      0.94     19448


Best Parameters:
{'C': 3220.851310553578, 'kernel': 'rbf', 'gamma': 1.573574177851053e-05}

Training Random Forest...

Results for Random Forest (TEST):
Accuracy: 0.8540
AUC: 0.9256
F1: 0.7770
MCC: 0.6728
Precision: 0.8352
Recall: 0.7264

Confusion Matrix:
[[2915  244]
 [ 466 1237]]

Classification Report:
                   pre       rec       spe        f1       geo       iba       sup

      False       0.86      0.92      0.73      0.89      0.82      0.68      3159
       True       0.84      0.73      0.92      0.78      0.82      0.66      1703

avg / total       0.85      0.85      0.80      0.85      0.82      0.67      4862


Results for Random Forest (TRAIN):
Accuracy: 0.9876
AUC: 0.9994
F1: 0.9819
MCC: 0.9728
Precision: 0.9998
Recall: 0.9646

Confusion Matrix:
[[12637     1]
 [  241  6569]]

Classification Report:
                   pre       rec       spe        f1       geo       iba       sup

      False       0.98      1.00      0.96      0.99      0.98      0.97     12638
       True       1.00      0.96      1.00      0.98      0.98      0.96      6810

avg / total       0.99      0.99      0.98      0.99      0.98      0.97     19448


Best Parameters:
{'n_estimators': 360, 'max_depth': 57, 'min_samples_split': 8, 'min_samples_leaf': 3, 'max_features': 'sqrt'}

Training XGBoost...

Results for XGBoost (TEST):
Accuracy: 0.8616
AUC: 0.9363
F1: 0.8063
MCC: 0.6990
Precision: 0.7906
Recall: 0.8227

Confusion Matrix:
[[2788  371]
 [ 302 1401]]

Classification Report:
                   pre       rec       spe        f1       geo       iba       sup

      False       0.90      0.88      0.82      0.89      0.85      0.73      3159
       True       0.79      0.82      0.88      0.81      0.85      0.72      1703

avg / total       0.86      0.86      0.84      0.86      0.85      0.73      4862


Results for XGBoost (TRAIN):
Accuracy: 1.0000
AUC: 1.0000
F1: 1.0000
MCC: 1.0000
Precision: 1.0000
Recall: 1.0000

Confusion Matrix:
[[12638     0]
 [    0  6810]]

Classification Report:
                   pre       rec       spe        f1       geo       iba       sup

      False       1.00      1.00      1.00      1.00      1.00      1.00     12638
       True       1.00      1.00      1.00      1.00      1.00      1.00      6810

avg / total       1.00      1.00      1.00      1.00      1.00      1.00     19448


Best Parameters:
{'n_estimators': 525, 'max_depth': 14, 'learning_rate': 0.09231972475439738, 'subsample': 0.9992707236412883, 'colsample_bytree': 0.650832203397447, 'min_child_weight': 4, 'gamma': 0.707093291483827, 'reg_alpha': 0.9200519222241569, 'reg_lambda': 0.9393638250067533, 'scale_pos_weight': 1.6638021181684965}

Creating ensemble model...
/home/prateek/miniconda3/lib/python3.12/site-packages/sklearn/linear_model/_logistic.py:469: ConvergenceWarning: lbfgs failed to converge (status=1):
STOP: TOTAL NO. of ITERATIONS REACHED LIMIT.

Increase the number of iterations (max_iter) or scale the data as shown in:
    https://scikit-learn.org/stable/modules/preprocessing.html
Please also refer to the documentation for alternative solver options:
    https://scikit-learn.org/stable/modules/linear_model.html#logistic-regression
  n_iter_i = _check_optimize_result(

Ensemble Model Results:
Accuracy: 0.8606
AUC: 0.9334
F1: 0.7966
MCC: 0.6910
Precision: 0.8142
Recall: 0.7798

Confusion Matrix:
[[2856  303]
 [ 375 1328]]

Classification Report:
                   pre       rec       spe        f1       geo       iba       sup

      False       0.88      0.90      0.78      0.89      0.84      0.71      3159
       True       0.81      0.78      0.90      0.80      0.84      0.70      1703

avg / total       0.86      0.86      0.82      0.86      0.84      0.71      4862


Saving models...
All models saved successfully.
